{
  "record_type": "verification_run",
  "schema_version": "1.0.0",
  "verification_id": "verification.scene-001.v1",
  "mode": "machine_only",
  "provenance": {
    "taxonomy": {
      "name": "cn-failure-atlas",
      "version": "2.0.0-alpha.1",
      "digest": "1111111111111111111111111111111111111111111111111111111111111111",
      "uri": "../../taxonomy.json"
    },
    "schema": {
      "id": "https://yuqing-cai.github.io/cn-failure-atlas/schemas/verification-run.schema.json",
      "version": "1.0.0",
      "digest": "cccccccccccccccccccccccccccccccccccccccccccccccccccccccccccccccc"
    },
    "runner": {
      "name": "atlas-machine-loop",
      "version": "0.1.0",
      "commit": "1a2b3c4"
    },
    "prompt_bundle": {
      "id": "prompt.verification.v1",
      "version": "1.0.0",
      "digest": "dddddddddddddddddddddddddddddddddddddddddddddddddddddddddddddddd"
    },
    "digest_status": "example_placeholder",
    "created_at": "2026-08-24T10:05:00Z"
  },
  "policy_ref": {
    "record_id": "policy.machine-only.v1",
    "policy_version": "1.0.0",
    "schema_id": "https://yuqing-cai.github.io/cn-failure-atlas/schemas/evolution-policy.schema.json",
    "schema_version": "1.0.0",
    "uri": "evolution-policy.example.json"
  },
  "promotion_target": "repair_strategy",
  "diagnostic_trace_ref": {
    "record_id": "trace.scene-001.v1",
    "schema_id": "https://yuqing-cai.github.io/cn-failure-atlas/schemas/diagnostic-trace.schema.json",
    "schema_version": "1.0.0",
    "uri": "diagnostic-trace.example.json"
  },
  "repair_attempt_ref": {
    "record_id": "repair.scene-001.v1",
    "schema_id": "https://yuqing-cai.github.io/cn-failure-atlas/schemas/repair-attempt.schema.json",
    "schema_version": "1.0.0",
    "uri": "repair-attempt.example.json"
  },
  "generator": {
    "id": "actor.repairer-01",
    "origin": {
      "provider": "example-provider-a",
      "model": "repair-model",
      "model_version": "2026-08-15",
      "endpoint_class": "hosted"
    }
  },
  "judges": [
    {
      "id": "actor.judge-01",
      "origin": {
        "provider": "example-provider-b",
        "model": "judge-model-blue",
        "model_version": "2026-08-18",
        "endpoint_class": "hosted"
      }
    },
    {
      "id": "actor.judge-02",
      "origin": {
        "provider": "example-provider-c",
        "model": "judge-model-green",
        "model_version": "2026-08-12",
        "endpoint_class": "hosted"
      }
    }
  ],
  "actor_profiles": {
    "generator": {
      "id": "actor.repairer-01",
      "origin": {
        "provider": "example-provider-a",
        "model": "repair-model",
        "model_version": "2026-08-15",
        "endpoint_class": "hosted"
      },
      "kind": "machine",
      "role": "repairer",
      "prompt": {
        "bundle_id": "prompt.repair.v1",
        "version": "1.0.0",
        "digest": "8888888888888888888888888888888888888888888888888888888888888888"
      },
      "context_partition": "repair/scene-001/fresh",
      "seed": 5101,
      "temperature": 0.3
    },
    "judges": [
      {
        "id": "actor.judge-01",
        "origin": {
          "provider": "example-provider-b",
          "model": "judge-model-blue",
          "model_version": "2026-08-18",
          "endpoint_class": "hosted"
        },
        "kind": "machine",
        "role": "judge",
        "prompt": {
          "bundle_id": "prompt.verification.v1",
          "version": "1.0.0",
          "digest": "dddddddddddddddddddddddddddddddddddddddddddddddddddddddddddddddd"
        },
        "context_partition": "judge-blue/scene-001/blind",
        "seed": 6101,
        "temperature": 0
      },
      {
        "id": "actor.judge-02",
        "origin": {
          "provider": "example-provider-c",
          "model": "judge-model-green",
          "model_version": "2026-08-12",
          "endpoint_class": "hosted"
        },
        "kind": "machine",
        "role": "judge",
        "prompt": {
          "bundle_id": "prompt.verification.v1",
          "version": "1.0.0",
          "digest": "dddddddddddddddddddddddddddddddddddddddddddddddddddddddddddddddd"
        },
        "context_partition": "judge-green/scene-001/blind",
        "seed": 6201,
        "temperature": 0
      }
    ],
    "aggregator": {
      "id": "actor.aggregator-01",
      "origin": {
        "provider": "local-orchestrator",
        "model": "deterministic-gate",
        "model_version": "0.1.0",
        "endpoint_class": "local"
      },
      "kind": "machine",
      "role": "aggregator",
      "prompt": {
        "bundle_id": "prompt.aggregation.v1",
        "version": "1.0.0",
        "digest": "eeeeeeeeeeeeeeeeeeeeeeeeeeeeeeeeeeeeeeeeeeeeeeeeeeeeeeeeeeeeeeee"
      },
      "context_partition": "aggregation/scene-001",
      "seed": 1,
      "temperature": 0
    }
  },
  "identity_isolation": {
    "pairs": [
      {
        "left_actor_id": "actor.repairer-01",
        "right_actor_id": "actor.judge-01",
        "mechanisms": [
          "separate_context",
          "separate_prompt",
          "separate_provider",
          "blinded_candidate_identity",
          "no_shared_scratchpad"
        ],
        "independent_context": true,
        "verified": true
      },
      {
        "left_actor_id": "actor.repairer-01",
        "right_actor_id": "actor.judge-02",
        "mechanisms": [
          "separate_context",
          "separate_prompt",
          "separate_provider",
          "blinded_candidate_identity",
          "no_shared_scratchpad"
        ],
        "independent_context": true,
        "verified": true
      },
      {
        "left_actor_id": "actor.judge-01",
        "right_actor_id": "actor.aggregator-01",
        "mechanisms": [
          "separate_context",
          "separate_prompt",
          "no_shared_scratchpad"
        ],
        "independent_context": true,
        "verified": true
      },
      {
        "left_actor_id": "actor.judge-02",
        "right_actor_id": "actor.aggregator-01",
        "mechanisms": [
          "separate_context",
          "separate_prompt",
          "no_shared_scratchpad"
        ],
        "independent_context": true,
        "verified": true
      }
    ],
    "no_shared_scratchpad": true,
    "role_prompts_separated": true,
    "same_weights_allowed": true
  },
  "candidates": {
    "baseline": {
      "candidate_id": "baseline",
      "blind_alias": "A",
      "digest": "4444444444444444444444444444444444444444444444444444444444444444"
    },
    "candidate": {
      "candidate_id": "candidate",
      "blind_alias": "B",
      "digest": "5555555555555555555555555555555555555555555555555555555555555555"
    }
  },
  "blinding": {
    "mapping_digest": "6666666666666666666666666666666666666666666666666666666666666666",
    "mapping_visible_to": "aggregator_only",
    "candidate_origin_hidden": true,
    "model_identity_hidden": true,
    "judge_contexts_reset_between_orders": true
  },
  "order_trials": [
    {
      "trial_id": "trial.repeat-001.judge-01.ab",
      "repeat_id": "repeat-001",
      "judge_id": "actor.judge-01",
      "order": "AB",
      "winner": "candidate",
      "raw_choice": "B",
      "rationale": "B保留冲突和用户角色控制权，且以动作而非互相确认承载感情。"
    },
    {
      "trial_id": "trial.repeat-001.judge-01.ba",
      "repeat_id": "repeat-001",
      "judge_id": "actor.judge-01",
      "order": "BA",
      "winner": "candidate",
      "raw_choice": "B",
      "rationale": "交换呈现顺序后，B仍更符合不立刻和解的场景契约。"
    },
    {
      "trial_id": "trial.repeat-001.judge-02.ab",
      "repeat_id": "repeat-001",
      "judge_id": "actor.judge-02",
      "order": "AB",
      "winner": "candidate",
      "raw_choice": "B",
      "rationale": "B没有替她行动，也没有消除退婚的即时后果。"
    },
    {
      "trial_id": "trial.repeat-001.judge-02.ba",
      "repeat_id": "repeat-001",
      "judge_id": "actor.judge-02",
      "order": "BA",
      "winner": "candidate",
      "raw_choice": "B",
      "rationale": "换序后选择不变；B的停顿与推纸形成一致的行为逻辑。"
    },
    {
      "trial_id": "trial.repeat-002.judge-01.ab",
      "repeat_id": "repeat-002",
      "judge_id": "actor.judge-01",
      "order": "AB",
      "winner": "candidate",
      "raw_choice": "B",
      "rationale": "独立重采样仍判断B修复了过早感情封闭。"
    },
    {
      "trial_id": "trial.repeat-002.judge-01.ba",
      "repeat_id": "repeat-002",
      "judge_id": "actor.judge-01",
      "order": "BA",
      "winner": "candidate",
      "raw_choice": "B",
      "rationale": "独立重采样和换序均未改变结论。"
    },
    {
      "trial_id": "trial.repeat-002.judge-02.ab",
      "repeat_id": "repeat-002",
      "judge_id": "actor.judge-02",
      "order": "AB",
      "winner": "candidate",
      "raw_choice": "B",
      "rationale": "B让保护动机保持可推断而非直接宣告。"
    },
    {
      "trial_id": "trial.repeat-002.judge-02.ba",
      "repeat_id": "repeat-002",
      "judge_id": "actor.judge-02",
      "order": "BA",
      "winner": "candidate",
      "raw_choice": "B",
      "rationale": "B在换序中仍胜出，未观察到位置偏差。"
    }
  ],
  "evidence_checks": [
    {
      "check_id": "evidence-check.judge-01",
      "finding_id": "finding.affective-closure-001",
      "evidence_ids": [
        "evidence.closure-001"
      ],
      "judge_id": "actor.judge-01",
      "covered": true,
      "reason": "候选删除了证据片段中的互相确认和拥抱，并保留决定的代价。"
    },
    {
      "check_id": "evidence-check.judge-02",
      "finding_id": "finding.affective-closure-001",
      "evidence_ids": [
        "evidence.closure-001"
      ],
      "judge_id": "actor.judge-02",
      "covered": true,
      "reason": "候选直接改写被引用的封闭机制，没有用无关润色替代修复。"
    }
  ],
  "target_failure_checks": [
    {
      "check_id": "target-check.judge-01",
      "finding_id": "finding.affective-closure-001",
      "judge_id": "actor.judge-01",
      "baseline_present": true,
      "candidate_present": false,
      "evidence_reduced": true,
      "reason": "原版中的互相确认仍可定位，候选已删除该封闭机制。"
    },
    {
      "check_id": "target-check.judge-02",
      "finding_id": "finding.affective-closure-001",